{
  "schemaVersion": 1,
  "character": "bebben",
  "stage": "face",
  "iteration": "eyelid-study",
  "reviewer": "unreviewed",
  "sourceSha256": "1934c5dfe05b14c6d01056551b831e6eed7c0601773ef0a4ae687e70dca1c773",
  "evidence": [
    {
      "path": "art/characters/bebben/review/iterations/eyelid-study/full-front.png",
      "sha256": "4b665c7b47baef81d227e43bf767ca9be0774b655b4ed62e1d36cd47f98fa92e",
      "view": "full-front"
    },
    {
      "path": "art/characters/bebben/review/iterations/eyelid-study/full-quarter-left.png",
      "sha256": "adc7f6693acca987d4f1c0d9315a929231a066bf05836d954c53f9d35d4856ef",
      "view": "full-quarter-left"
    },
    {
      "path": "art/characters/bebben/review/iterations/eyelid-study/full-quarter-right.png",
      "sha256": "c0d4ddbc159919d48476818696efec9911fac16c0cd92e8bbd00f1e2a2c85a22",
      "view": "full-quarter-right"
    },
    {
      "path": "art/characters/bebben/review/iterations/eyelid-study/full-side.png",
      "sha256": "455901dba1530a5fb8bfe21d0b0b98f461c5c0ed2608e3caf6563c05b313b3c6",
      "view": "full-side"
    },
    {
      "path": "art/characters/bebben/review/iterations/eyelid-study/full-back.png",
      "sha256": "b7d9fb5cacc5708cf9222aebeaf451589cb78d4ea364dba5a61ffe70b5c7a21e",
      "view": "full-back"
    },
    {
      "path": "art/characters/bebben/review/iterations/eyelid-study/portrait-front.png",
      "sha256": "f9142d4fb8c726aa777d05a9c5e2920669b2dab657f8eda2e0ac7e112e251fba",
      "view": "portrait-front"
    },
    {
      "path": "art/characters/bebben/review/iterations/eyelid-study/portrait-quarter-left.png",
      "sha256": "95e8a4ac65cd3fe5f8c9de45438208fbff7ba3fa59facfd54cfc462d55f7710a",
      "view": "portrait-quarter-left"
    },
    {
      "path": "art/characters/bebben/review/iterations/eyelid-study/portrait-quarter-right.png",
      "sha256": "a82b1c84fed11f00200ff231964c4d21cd18e3de7ad431c1a9f736726e0ad104",
      "view": "portrait-quarter-right"
    },
    {
      "path": "art/characters/bebben/review/iterations/eyelid-study/portrait-side.png",
      "sha256": "12cc4f9e03befef9e01599bed8d14055fb8e1870b2fa51519dee18837f03d15a",
      "view": "portrait-side"
    },
    {
      "path": "art/characters/bebben/review/iterations/eyelid-study/portrait-above.png",
      "sha256": "d4ef121a3e930e7fbca38aa72eebcb8bdb3a508a05f15cb77545ae25295a0c19",
      "view": "portrait-above"
    },
    {
      "path": "art/characters/bebben/review/iterations/eyelid-study/portrait-below.png",
      "sha256": "5491625e5d0b1ec93e12a1b48e43fbd32d78123e9997160e29c56354aa289177",
      "view": "portrait-below"
    },
    {
      "path": "art/characters/bebben/review/iterations/eyelid-study/detail-eyes.png",
      "sha256": "3f984b3a04698d405d4710159c99390cbba81ac1ab312742c1724c3fa0dccf7a",
      "view": "detail-eyes"
    },
    {
      "path": "art/characters/bebben/review/iterations/eyelid-study/detail-hair.png",
      "sha256": "e97b2d2325374d3682fd6fa6ad43f3b5e3e4627402d471232159e220faf4bbec",
      "view": "detail-hair"
    },
    {
      "path": "art/characters/bebben/review/iterations/eyelid-study/detail-hands.png",
      "sha256": "97e7471f2f967f625427f9075eb4f33cd35fbc67c11b191ea6dc354fdb57cf58",
      "view": "detail-hands"
    },
    {
      "path": "art/characters/bebben/review/iterations/eyelid-study/detail-footwear.png",
      "sha256": "675ca4d142136d2e9ea5b67f2c0315d2c0529feb52cf60247e0e0c812f5d16e8",
      "view": "detail-footwear"
    },
    {
      "path": "art/characters/bebben/review/iterations/eyelid-study/detail-clothing.png",
      "sha256": "73c281372a413b5b52f9bb1eed0abfede92eed6db96701fa47df9c833e9aac1f",
      "view": "detail-clothing"
    },
    {
      "path": "art/characters/bebben/review/iterations/eyelid-study/light-front.png",
      "sha256": "83b5ab7efa317aa1d61e9cae76205192248bbcc42062ebd186b378d2f98b809b",
      "view": "light-front"
    },
    {
      "path": "art/characters/bebben/review/iterations/eyelid-study/light-quarter.png",
      "sha256": "ee30d10d8fda4de57a38398cd9730f36ecf26d3c432bf796a2b5e9dc712ebef4",
      "view": "light-quarter"
    },
    {
      "path": "art/characters/bebben/review/iterations/eyelid-study/light-side.png",
      "sha256": "18c98636981c4fe5f69bd149cc9cce893e15b75e2bbb9410e0d7a28eaeaadfab",
      "view": "light-side"
    },
    {
      "path": "art/characters/bebben/review/iterations/eyelid-study/light-opposite.png",
      "sha256": "cb7d32bdf52492ab15f1504dbc82fbf23e5016c1fb4e4027d3fad773737bf86a",
      "view": "light-opposite"
    },
    {
      "path": "art/characters/bebben/review/iterations/eyelid-study/light-neutral.png",
      "sha256": "da608aabb5ef33c643b16c616d0e038f4b43b6b894a726a023b1780e4e43ba39",
      "view": "light-neutral"
    },
    {
      "path": "art/characters/bebben/review/iterations/eyelid-study/light-dramatic.png",
      "sha256": "6b2cb55165df4c51edc32a668019a20c21ef1d3014bf9f238b00579d4b71b66b",
      "view": "light-dramatic"
    }
  ],
  "categories": {
    "overall": {
      "score": 0,
      "severity": "NOT_REVIEWED",
      "location": "overall",
      "observedProblem": "Not visually inspected.",
      "visualConsequence": "Quality is unknown.",
      "recommendedAction": "Inspect rendered evidence and classify honestly.",
      "blocksNextStage": true
    },
    "silhouette": {
      "score": 0,
      "severity": "NOT_REVIEWED",
      "location": "silhouette",
      "observedProblem": "Not visually inspected.",
      "visualConsequence": "Quality is unknown.",
      "recommendedAction": "Inspect rendered evidence and classify honestly.",
      "blocksNextStage": true
    },
    "face": {
      "score": 0,
      "severity": "NOT_REVIEWED",
      "location": "face",
      "observedProblem": "Not visually inspected.",
      "visualConsequence": "Quality is unknown.",
      "recommendedAction": "Inspect rendered evidence and classify honestly.",
      "blocksNextStage": true
    },
    "eyes": {
      "score": 0,
      "severity": "NOT_REVIEWED",
      "location": "eyes",
      "observedProblem": "Not visually inspected.",
      "visualConsequence": "Quality is unknown.",
      "recommendedAction": "Inspect rendered evidence and classify honestly.",
      "blocksNextStage": true
    },
    "profile": {
      "score": 0,
      "severity": "NOT_REVIEWED",
      "location": "profile",
      "observedProblem": "Not visually inspected.",
      "visualConsequence": "Quality is unknown.",
      "recommendedAction": "Inspect rendered evidence and classify honestly.",
      "blocksNextStage": true
    },
    "hair": {
      "score": 0,
      "severity": "NOT_REVIEWED",
      "location": "hair",
      "observedProblem": "Not visually inspected.",
      "visualConsequence": "Quality is unknown.",
      "recommendedAction": "Inspect rendered evidence and classify honestly.",
      "blocksNextStage": true
    },
    "anatomy": {
      "score": 0,
      "severity": "NOT_REVIEWED",
      "location": "anatomy",
      "observedProblem": "Not visually inspected.",
      "visualConsequence": "Quality is unknown.",
      "recommendedAction": "Inspect rendered evidence and classify honestly.",
      "blocksNextStage": true
    },
    "clothing": {
      "score": 0,
      "severity": "NOT_REVIEWED",
      "location": "clothing",
      "observedProblem": "Not visually inspected.",
      "visualConsequence": "Quality is unknown.",
      "recommendedAction": "Inspect rendered evidence and classify honestly.",
      "blocksNextStage": true
    },
    "hands": {
      "score": 0,
      "severity": "NOT_REVIEWED",
      "location": "hands",
      "observedProblem": "Not visually inspected.",
      "visualConsequence": "Quality is unknown.",
      "recommendedAction": "Inspect rendered evidence and classify honestly.",
      "blocksNextStage": true
    },
    "materials": {
      "score": 0,
      "severity": "NOT_REVIEWED",
      "location": "materials",
      "observedProblem": "Not visually inspected.",
      "visualConsequence": "Quality is unknown.",
      "recommendedAction": "Inspect rendered evidence and classify honestly.",
      "blocksNextStage": true
    },
    "shader": {
      "score": 0,
      "severity": "NOT_REVIEWED",
      "location": "shader",
      "observedProblem": "Not visually inspected.",
      "visualConsequence": "Quality is unknown.",
      "recommendedAction": "Inspect rendered evidence and classify honestly.",
      "blocksNextStage": true
    },
    "deformation": {
      "score": 0,
      "severity": "NOT_REVIEWED",
      "location": "deformation",
      "observedProblem": "Not visually inspected.",
      "visualConsequence": "Quality is unknown.",
      "recommendedAction": "Inspect rendered evidence and classify honestly.",
      "blocksNextStage": true
    }
  },
  "topThree": [
    {
      "rank": 1,
      "category": "silhouette",
      "location": "Unreviewed",
      "problem": "Requires visual inspection.",
      "consequence": "Cannot advance without critique.",
      "correction": "Inspect and replace this entry with a concrete ranked correction."
    },
    {
      "rank": 2,
      "category": "face",
      "location": "Unreviewed",
      "problem": "Requires visual inspection.",
      "consequence": "Cannot advance without critique.",
      "correction": "Inspect and replace this entry with a concrete ranked correction."
    },
    {
      "rank": 3,
      "category": "eyes",
      "location": "Unreviewed",
      "problem": "Requires visual inspection.",
      "consequence": "Cannot advance without critique.",
      "correction": "Inspect and replace this entry with a concrete ranked correction."
    }
  ],
  "comparison": {
    "previousIteration": null,
    "improved": "baseline",
    "observations": "No comparison recorded yet."
  }
}
